document_id,content
doc228,preheat oven degree f degree c grease flour tube pan sift together flour salt cinnamon nutmeg allspice set aside dissolve baking soda hot water set aside large bowl beat egg electric mixer thick lemon colored beat sugar oil combine buttermilk dissolved baking soda beat flour mixture alternately buttermilk mixture stir vanilla fig nut pour prepared pan bake preheated oven minute remove pan pour hot buttermilk icing warm cake make buttermilk icing heavy saucepan combine sugar buttermilk baking soda corn syrup butter bring boil cook soft ball stage degree degree c remove stove stir vanilla pour warm cake
doc229,set oven rack heat source preheat oven broiler arrange fig half cut side baking sheet top fig half goat cheese lay prosciutto strip atop goat cheese layer broil fig preheated oven prosciutto crisp goat cheese melted minute transfer warm fig serving platter drizzle honey
doc230,combine lettuce orange gorgonzola cheese fig large bowl drizzle dressing salad toss coat
doc231,scoop flesh fig spoon discard peel bring sugar water boil large saucepan heat stirring sugar dissolved stir fig pulp lime juice cinnamon ginger white pepper cook stirring often candy thermometer read degree f degree c minute preserve cooking sterilize jar lid boiling water least minute pack hot preserve sterilized jar within top top jar sterilized lid let cool storing preserve refrigerator
doc232,process cranberry juice strawberry blueberry watermelon banana fig blender smooth creamy enjoy immediately keep cool refrigerator
doc233,heat saucepan medium heat add brown sugar water salt fig cook stir sugar dissolved fig softened minute remove heat stir vanilla extract cool minute place cream cheese platter pour fig mixture cream cheese
doc234,preheat oven degree f degree c place baguette slice ungreased baking sheet bake bread preheated oven bottom brown minute flip bake crisp minute remove pan oven spread ricotta slice toasted bread place ribbon basil arrange slice fig top drizzle finished crostini balsamic vinegar
doc235,heat vegetable stock large pot keep warm low heat heat butter olive oil large saucepan heat add green onion cook stir softened minute pour rice stir coated butter oil starting toast minute increase heat pour wine simmer alcohol evaporated wine mostly absorbed reduce heat medium stir ladle boiling broth continue stirring rice absorbed liquid turned creamy liquid fully absorbed add next ladle repeat process stirring constantly liquid used rice tender yet firm bite al dente stirring broth take minute meanwhile chop fig melt butter medium skillet cook chopped fig soft coated butter minute crush fig gently wooden spoon cooking stir prosciutto add mixture risotto minute left cook remove risotto heat stir remaining butter grated pecorino romano cheese let stand minute divide risotto evenly onto plate garnishing whole fig serving
doc236,bring water brown sugar maple extract boil saucepan add cranberry fig cook medium heat stirring frequently slightly thickened minute add rosemary cook sauce thickened minute carefully remove rosemary sprig discard remove pot burner let cool minute pour sauce bowl refrigerate ready serve
doc237,mix fig sugar lemon slice strawberry gelatin large pot let stand hour bring boil cook medium heat stirring often prevent burning foam disappeared preserve thickened minute sterilize jar lid boiling water least minute pack fig preserve hot sterilized jar filling jar within top run knife thin spatula around inside jar filled remove air bubble wipe rim jar moist paper towel remove food residue top lid screw ring place rack bottom large stockpot fill halfway water bring boil lower jar boiling water using holder leave space jar pour boiling water necessary bring water level least top jar bring water rolling boil cover pot process minute remove jar stockpot place onto wood surface several apart cool cool press top lid finger ensuring seal tight lid move store cool dark area wait least day opening
doc238,preheat oven degree f degree c spread olive oil baking sheet heat olive oil skillet medium heat cook stir shallot translucent minute stir garlic thyme salt pepper shallot cook stir fragrant minute transfer shallot mixture bowl stir goat cheese mozzarella cheese cream cheese fig basil well combined pound chicken breast work surface thin spoon goat cheese mixture onto middle piece chicken roll chicken around filling wrap piece prosciutto around chicken roll covering opening layer prosciutto place chicken roll onto prepared baking sheet bake preheated oven minute turn chicken continue baking chicken longer pink center prosciutto crisp minute thermometer inserted center read least degree f degree c let chicken stand minute serving
doc239,heat butter saucepan low heat gradually stir flour melted butter smooth bubbly minute add salt stir combine remove heat gradually stir milk smooth return white sauce stovetop bring boil reduce heat simmer low heat cook stir prosciutto fig pan medium heat warm minute stir lemon zest lemon pepper seasoning white sauce serve fig prosciutto atop sauce
doc240,bring fig sugar lemon juice ginger cinnamon vanilla salt simmer saucepan medium heat reduce heat cook low simmer stirring every minute desired consistency hour inspect half jar crack ring rust discarding defective one immerse simmering water fig preserve ready wash new unused lid ring warm soapy water pack fig preserve hot sterilized jar filling within top run clean knife thin spatula around inside jar remove air bubble wipe rim moist paper towel remove residue top lid screw ring tightly place rack bottom large stockpot fill halfway water bring boil lower jar apart boiling water using holder pour boiling water cover jar least bring rolling boil cover process minute remove jar stockpot let rest several apart hour press center lid finger ensure lid move remove ring storage store cool dark area
doc241,soak fig whiskey bowl least minute preheat oven degree f degree c line muffin tin paper liner combine flour baking powder baking soda salt cinnamon cream tartar clove bowl blend white sugar oil brown sugar together separate bowl using electric mixer add egg mix creamy mix buttermilk vanilla extract reserve fig mixture frosting mix remainder batter beat flour mixture combined spoon batter prepared muffin filling full bake preheated oven toothpick inserted center cupcake come clean minute remove oven transfer wire rack cool completely minute beat cream cheese shortening together bowl using electric mixer creamy add powdered sugar slowly time creamy add vanilla extract slowly drizzle reserved fig mixture mix frosting combined pipe frosting onto cooled cupcake
doc242,heat skillet medium heat add oil add onion cook stir onion softened turned translucent minute reduce heat low continue cooking stirring onion tender dark brown minute remove heat cool onion cooling cut fig lengthwise round layer goat cheese caramelized onion fig slice cracker
doc243,combine olive oil lemon juice orange blossom water orange juice orange zest glass jar shake dressing emulsified arrange arugula salad platter place fig top top gorgonzola cheese scatter crushed pistachio garnish season salt pepper pour dressing salad serve immediately
doc244,heat fig red wine sugar honey red pepper flake salt small saucepan medium heat simmer wine reduced thickened minute stirring occasionally
doc245,heat skillet heat sear pork chop hot skillet lightly browned minute per side transfer seared pork chop slow cooker combine cranberry fig reserved fig juice apple juice brown sugar salt black pepper rosemary saucepan bring boil pour cranberry mixture pork chop cook high hour
doc246,preheat oven degree f degree c line baking sheet foil place fig pine nut bowl food processor pulse fine place halved peach onto prepared baking sheet cut side sprinkle evenly white sugar pour white wine peach stuff fig mixture pour brandy peach bake preheated oven browned minute
doc247,blend yogurt orange juice cantaloupe ice cube blender smooth second
doc248,place watermelon blender cover puree smooth strain fine mesh sieve bring sugar water boil saucepan heat sugar dissolve minute remove heat stir cold water lemon juice divide ice glass scoop watermelon puree ice top lemonade gently stir serving
doc249,blend watermelon water honey lemon juice sugar together blender smooth pour mixture ice pop mold freeze solid hour run hot water ice pop mold second unmold
doc250,gently mix watermelon tomato feta cheese onion mint large bowl whisk olive oil vinegar salt pepper together small bowl drizzle salad gently toss coat
doc251,blender combine cantaloupe honeydew lime juice sugar blend smooth pour glass serve
doc252,process watermelon milk together blender smooth add sugar blend another second incorporate serve immediately
doc253,combine sugar water lemon juice saucepan medium heat cook stir sugar dissolved minute remove heat refrigerate cooled minute blend watermelon blender food processor pureed stir pureed watermelon sugar mixture transfer watermelon mixture ice cream maker freeze according manufacturer instruction
doc254,mix red onion lime juice bowl set side marinate least minute stir olive oil mixture toss watermelon baby cucumber feta cheese together large bowl pour red onion mixture watermelon mixture toss coat sprinkle mint salad toss
doc255,small bowl pour lime juice red onion allow marinate assembling salad gently combine watermelon cucumber feta cheese cilantro large bowl season black pepper toss watermelon salad marinated onion season sea salt serving cookinbug
doc256,stack basil leaf top roll tightly log slice lengthwise thin ribbon combine basil slice watermelon large bowl drizzle lemon juice watermelon mix salt chili powder together small bowl sprinkle watermelon toss combine chill salad serving least minute
doc257,mix cumin coriander chili powder salt cayenne pepper together bowl place watermelon serving bowl sprinkle spice mixture squeeze lime juice spiced watermelon
doc258,combine watermelon sugar lemon juice salt large mixing bowl stir coat evenly cover bowl plastic wrap refrigerator minute blend mixture blender smooth return bowl pour cold water saucepan sprinkle gelatin cold water let stand minute place saucepan low heat cook minute stir gelatin mixture blended watermelon mixture add heavy cream beat electric hand mixer medium speed mixture fluffy transfer mixture ice cream maker freeze according manufacturer direction reach consistency transfer ice cream lidded plastic container cover surface plastic wrap seal best result ice cream ripen freezer least hour overnight
doc259,trim basil leaf small circle diameter thread watermelon mozzarella cheese toothpick sandwiching basil leaf arrange serving plate pour olive oil balsamic vinegar toothpick sprinkle salt black pepper top
doc260,blend watermelon lemon juice mint honey blender smooth refrigerate hour serving
doc261,whisk olive oil white balsamic vinegar salt together small bowl set aside combine arugula spinach onion tomato large salad bowl drizzle vinaigrette salad mixture toss coat add feta cheese watermelon serve
doc262,whisk olive oil vinegar salt together large mixing bowl add tomato arugula red onion toss coat gently stir watermelon feta cheese serve
doc263,bring sugar water orange zest small saucepan boil stirring constantly simmer sugar dissolved minute remove simple syrup heat allow cool completely place watermelon blender food processor pulse pureed stir watermelon puree large pitcher simple syrup tequila lime juice place small amount salt sugar saucer rub edge margarita glass lime wedge moisten lightly dip rim glass saucer rim glass tap excess salt sugar fill rimmed glass crushed ice pour margarita mixture glass garnish lime wedge serve france c
doc264,remove green rind watermelon dice white part small cube leaving red flesh mostly intact remove seed heavy stockpot combine prepared watermelon sugar lemon bring boil medium heat let mixture boil slowly hour stirring occasionally temperature mixture degree f degree c jam set sterilize jar lid boiling water least minute pack jam hot sterilized jar filling jar within top run knife thin spatula around inside jar filled remove air bubble wipe rim jar moist paper towel remove food residue top lid screw ring place rack bottom large stockpot fill halfway water bring boil high heat carefully lower jar pot using holder leave space jar pour boiling water necessary water level least top jar bring water full boil cover pot process minute remove jar stockpot let rest several apart hour press center lid finger ensure lid move remove ring storage store cool dark area
doc265,gently toss watermelon onion basil cilantro mint lime juice feta cheese olive oil balsamic vinegar salt black pepper together large bowl
doc266,grate watermelon fork rind large bowl leaving large chunk stir water pineapple evaporated milk coconut grated watermelon add sugar stir dissolved squeeze lime juice watermelon mixture
doc267,combine watermelon strawberry peach nectarine pear grape large mixing bowl whisk lemon juice mint lemon zest honey together small bowl drizzle fruit mixture toss coat refrigerate hour serving
doc268,create base tier cake cut slice watermelon thick crossway center melon trim rind watermelon slice place largest slice onto cake plate alternate layering sliced strawberry slice cantaloupe slice fresh pineapple follow watermelon slice repeat make layered fruit stack look like cake thinly slice piece remaining melon pineapple cookie cutter sharp knife cut remaining fruit slice decorative shape decorate cake tier cut fruit shape remaining berry refrigerate serving time serve slice cake sharp knife one wedge time set wedge onto plate
doc269,combine water watermelon sugar blender process smooth pour large pitcher stir lime juice remaining water taste adjust sugar lime juice refrigerate chilled hour
doc270,whisk together olive oil lemon juice vinegar salt pepper large bowl gently toss spring mix watermelon together vinaigrette top goat cheese hazelnut serve
doc271,large sharp knife remove top section watermelon melon baller scoop flesh inside watermelon removing many seed possible leave flesh inside shell watermelon scoop cantaloupe honeydew manner removing much flesh possible discarding rind refrigerate fruit separately ready assemble small saucepan heat bring water sugar boil remove heat continue stirring sugar completely dissolved add lemon zest set aside cool serve place watermelon ball cantaloupe honeydew orange pineapple strawberry grape large mixing bowl pour syrup toss thoroughly transfer mixture watermelon bowl serve set aside fruit mixture fit enough fruit refill bowl
doc272,run watermelon cucumber piece juicer following manufacturer instruction place juice pitcher stir lime juice serve melissa goff
doc273,scrape flesh honeydew melon quarter blender add ice cube water sugar blend smooth sugar dissolved serve immediately
doc274,place onion slice small bowl lime juice acid lime mellow flavor raw onion let stand minute large bowl combine watermelon cube feta cheese black olive onion lime juice mint drizzle olive oil toss blend dig prepared pleasant surprise
doc275,preheat oven degree f degree c mix cantaloupe sugar lemon juice melted butter flour vanilla cinnamon nutmeg together medium bowl pour square baking dish spread dry cake mix evenly cantaloupe mixture drizzle melted butter top bake preheated oven golden brown minute
doc276,cut watermelon rind long wide thick piece combine water sugar spearmint basil large pot bring rolling boil strain spearmint basil add watermelon rind making sure piece completely immersed cook rind soft minute drain watermelon piece arrange single layer dehydrator tray dry according manufacturer instruction piece candied dried hour
doc277,combine watermelon ice tequila sugar lime juice vodka orange liqueur blender blend well pour margarita glass
doc278,place watermelon ice blender pour lime juice sugar salt blend smooth
doc279,place cantaloupe blender top milk sugar cover blend smooth
doc280,bring water salt boil large enamel stockpot high heat add watermelon rind return boil cook minute drain rind colander bring vinegar boil sugar remove heat stir watermelon rind cover let stand overnight following day remove rind syrup using slotted spoon place clean bowl set stockpot onto stove high heat add sugar return syrup boil sugar dissolved remove stockpot heat stir watermelon rind cover let stand overnight day repeat process using sugar remove rind syrup using slotted spoon place clean bowl set stockpot onto stove high heat add sugar return syrup boil sugar dissolved remove stockpot heat stir watermelon rind cover let stand overnight repeat step every day day day sterilize canning jar ring lid boiling water pack watermelon rind sterilized jar making sure space air pocket side add two clove one cinnamon stick jar return syrup boil fill jar within top top lid screw ring place rack bottom large stockpot fill halfway boiling water carefully lower jar pot using holder leave space jar pour boiling water necessary top jar covered water bring water full boil cover pot process minute remove stockpot heat let jar stand water hour heat remove jar stockpot place onto wood surface several apart cool cool press top lid finger ensuring seal tight lid move store cool dark area week opening
doc281,place water cantaloupe sugar blender blend smooth divide ice two glass pour cantaloupe mixture ice
doc282,place watermelon water blender process high speed combined minute add cucumber lime juice sugar blend smooth pour mixture fine mesh strainer using spatula press remove pulp skip step important pour strained mixture large pitcher add remaining water stir well refrigerate least hour longer sprinkle chili lime seasoning onto small plate run lime wedge around top glass invert glass dip rim seasoning fill glass ice pour agua fresca garnish watermelon slice wedge lime slice
doc283,combine watermelon strawberry lemon juice sugar water blender blend smooth
doc284,preheat oven degree f degree c lightly grease flour two loaf pan beat together sugar puréed cantaloupe oil egg vanilla large bowl well combined sift together flour cinnamon baking soda salt baking powder ginger separate bowl stir flour mixture cantaloupe mixture combined divide batter evenly prepared pan bake preheated oven toothpick inserted center loaf come clean hour meanwhile make sauce combine brown sugar butter bowl cook microwave minute stirring interval mix pecan pour sauce warm loaf let cool hour serving
doc285,mix together watermelon gelatin water fold gelatin mixture dessert topping add cut watermelon pour mixture graham cracker crust cool refrigerator hour
doc286,select cantaloupe good quality cut half remove seed scoop pulp saucepan place pulp medium heat come gentle boil mash cantaloupe heat make pulp combine sugar flour salt add heated cantaloupe cook stirring thick amount flour seems large take considerable thickening obtain correct consistency large bowl beat egg yolk add water yolk add little cantaloupe mixture egg yolk order heat yolk gradually stir egg yolk mixture cantaloupe mixture continue cooking stirring thick creamy remove heat add butter margarine flavoring cantaloupe mixture pour baked pie shell beat egg white cream tartar together frothy continue beating adding sugar gradually beat thick peak form top pie meringue bake degree f degree c delicately brown top
doc287,combine watermelon spinach avocado together bowl whisk walnut oil olive oil lime juice paprika together bowl pour watermelon mixture toss coat
doc288,peel seed cube cantaloupe place cantaloupe orange juice blender food processor cover process smooth transfer large bowl stir lime juice cinnamon remaining orange juice cover refrigerate least one hour garnish mint desired
doc289,whisk olive oil vinegar salt pepper together bowl smooth mix watermelon onion mint together separate bowl drizzle dressing watermelon mixture add blue cheese toss well
doc290,large bowl combine watermelon green bell pepper lime juice cilantro green onion jalapeno garlic salt mix well serve
doc291,scoop flesh watermelon half transfer watermelon blender add cold water place folded towel blender lid blend liquefied minute strain fine mesh strainer large bowl remove fiber discard fiber left strainer skim discard excess foam juice desired place sugar water saucepan medium heat stir water hot sugar dissolved turn heat let simple syrup cool room temperature stir simple syrup watermelon juice taste pour drink pitcher refrigerate cold least minute serve fill tall glass ice cube pour agua fresca drink ice serve straw refreshing doughgirl
doc292,blend honeydew melon cucumber onion avocado jalapeño pepper garlic white balsamic vinegar lime juice salt black pepper blender smooth adjust seasoning desired chill serving
doc293,mix watermelon grape cantaloupe strawberry kiwi bowl lid top blueberry stir mint sugar lime juice together bowl crushing mint back spoon mixing extract flavor pour fruit mixture seal bowl lid refrigerate least hour serving gently flip sealed bowl several time coat fruit dressing
doc294,blend watermelon water sugar blender smooth
doc295,squeeze lime cocktail glass drop lime wedge juice add watermelon enough ice fill glass top pour gin tonic water watermelon ice stir
doc296,place watermelon cocktail shaker crush muddler add ice cube vodka cover shaker shake well strain cocktail martini glass
doc297,combine vodka lemon juice shot glass sprinkle sugar top place remaining sugar small plate dip lemon wedge sugar suck sugared lemon drinking shot
doc298,sauce bring orange juice lemon juice brown sugar orange zest lemon zest boil saucepan heat reduce heat simmer slightly thickened minute remove heat stir vanilla extract set aside cool salad layer fruit large clear glass bowl order pineapple strawberry kiwi fruit banana orange grape blueberry pour cooled sauce fruit cover refrigerate hour serving
doc299,combine lemon juice sugar butter egg lemon zest saucepan cook heat whisking constantly mixture thickens bubble minute
doc300,fill collins glass ice set aside freezer combine gin lemon juice simple syrup cocktail shaker add ice cover shake chilled strain chilled collins glass top club soda garnish lemon wedge lutzflcat
doc301,preheat oven degree f degree c rub hen olive oil lightly season salt pepper stuff lemon quarter rosemary sprig cavity place hen large heavy roasting pan arrange garlic clove around roast preheated oven minute meanwhile whisk wine chicken broth remaining olive oil together small bowl remove hen oven reduce oven temperature degree f degree c pour wine mixture hen continue roasting basting pan juice every minute hen golden brown juice run clear minute thermometer inserted near bone read degree f degree c transfer hen platter pouring cavity juice roasting pan discard lemon rosemary tent hen aluminum foil keep warm transfer pan juice garlic clove medium saucepan boil reduced sauce consistency minute cut hen half lengthwise arrange two half plate spoon sauce roasted garlic top garnish remaining rosemary sprig serve lc
doc302,melt butter large skillet medium heat stir garlic cook second fragrant arrange scallop single layer skillet cook golden brown one side minute turn scallop using tongs continue cooking firm opaque minute transfer scallop platter reserving butter skillet whisk lemon juice salt pepper butter pour sauce scallop serve david west
doc303,preheat oven degree f degree c put potato wedge large bowl drizzle olive oil lemon juice toss coat season salt oregano black pepper toss coat spread potato wedge single layer deep pan pour chicken broth potato roast potato preheated oven tender golden brown hour
doc304,juice lemon juice combine juice sugar water pitcher stir sugar dissolve taste add water desired chill serve ice dotdash meredith food studio
doc305,heat oil large saucepan degree f degree c stir olive oil together bowl fry wing hot oil longer pink bone juice run clear minute thermometer inserted near bone read degree f degree c toss hot wing mixture coat
doc306,mix together egg lemon juice shallow dish bowl mix together flour garlic powder paprika another shallow dish bowl dip chicken breast egg mixture flour mixture coat heat butter large skillet medium heat add chicken breast cook golden minute per side mix together broth remaining lemon juice medium bowl pour chicken skillet reduce heat let simmer thermometer inserted center read least degree f degree c minute place chicken serving platter cover lemon sauce garnish fresh lemon slice parsley sprig
doc307,combine butter lemon juice vanilla confectioner sugar large mixing bowl beat light fluffy add confectioner sugar lemon juice adjust consistency needed
doc308,whisk red wine vinegar dijon mustard garlic oregano salt pepper together small bowl slowly stream olive oil vinegar mixture whisking continuously well combined add lemon juice whisk combine pour vinaigrette jar bottle seal shake serving
doc309,combine pineapple juice sugar egg flour salt saucepan stir cook medium heat thickened remove heat stir lemon juice let cool room temperature hour bring large pot water boil add oil remaining salt add pasta cook al dente minute drain rinse cold water combine cooked pasta cooled egg mixture mandarin orange pineapple tidbit crushed pineapple whipped topping large bowl mix well refrigerate chilled hour overnight serving add marshmallow coconut toss serve
