document_id,content
doc480,place warm water salt egg butter pan bread machine add bread flour pour sugar edge pan make shallow hole flour add yeast close lid set machine dough cycle dough mixing combine prune prune juice sugar cinnamon clove lime juice saucepan bring boil reduce heat low simmer prune soft sauce thickened minute remove heat blend mixer food processor smooth bread machine signal end dough cycle transfer dough lightly floured surface divide dough small piece cover greased plastic wrap set aside minute small bowl mix together sugar flour stir melted butter cinnamon make crumbly streusel preheat oven degree f degree c grease large baking sheet line parchment paper shape kolache dough ball place prepared baking sheet press shallow hole center one fill prune filling top kolaches streusel let kolaches rest doubled size minute bake top lightly browned minute
doc481,scrub potato place large pot enough water cover bring boil cook tender minute drain cool potato cool enough handle peel press ricer large bowl set aside cool part process done much one day advance large bowl mix together prepared potato salt egg butter well blended gradually stir farina flour dough still wet flour mixed turn dough onto floured surface knead smooth minute split open plum crack remove pit replace pit sugar cube close floured surface roll dough thickness cut twelve square place one plum square bring corner around top pinch together seam seal bring large pot water slow boil place dumpling water time float surface continue cook minute transfer cooked dumpling covered bowl keep warm melt remaining butter small skillet medium heat stir bread crumb sugar continue cook stir browned remove bread crumb plate roll warm dumpling mixture entirely coated serve place dumpling two plate sprinkle little sugar little extra melted butter desired
doc482,combine flour baking powder large bowl mix sugar vanilla sugar salt add butter egg knead everything smooth dough shape dough ball press flat cover chill refrigerator hour overnight preheat oven degree f degree c grease baking sheet butter cut halved plum half without cutting way fan roll pastry dough lightly floured work surface line bottom side prepared baking sheet dough mix sugar cinnamon together bowl arrange plum side side pastry dough small plum overlap dot plum butter sprinkle cinnamon sugar almond bake preheated oven pastry crust lightly browned minute remove oven allow plum cake cool cut square serve lukewarm room temperature
doc483,preheat oven degree f degree c grease shallow quart baking dish place pitted prune saucepan enough water cover bring simmer cook prune tender still hold shape minute drain prune arrange bottom prepared baking dish whisk together flour white sugar vanilla sugar baking powder salt large bowl whisk egg one time beating well addition gradually pour milk stirring vigorously wooden spoon combined stir rum pour batter evenly prune bake preheated oven minute reduce oven temperature degree f bake filling firm risen little top browned minute serve warm room temperature
doc484,saucepan low heat warm milk degree f degree c stir flour sugar remove heat transfer bowl crumble cake yeast milk mixture gently stir mixture becomes creamy cover pan cloth set aside warm place yeast form spongy texture minute melt margarine saucepan low heat remove heat allow cool lukewarm preheat oven degree f degree c grease baking dish sprinkle bread crumb place egg sugar blender process mixture yellow fluffy large mixing bowl whisk together flour vanilla sugar stir egg mixture activated yeast mixture lukewarm margarine start kneading milk needed dough little time dough stop sticking finger becomes smooth even knead least minute working incorporate much air possible dough knead press dough evenly prepared baking sheet arrange plum top dough set aside bowl cut together flour butter sugar pastry cutter mixture resembles fine crumb sprinkle streusel mixture plum dust streusel cinnamon desired bake preheated oven toothpick inserted center cake come clean hour hour minute
doc485,working batch place apple plum onion work bowl food processor grind fine transfer ground fruit onion large pot stir malt vinegar sugar salt worcestershire sauce garlic ginger nutmeg allspice cayenne pepper mixture well combined bring simmer low heat simmer brown thickened hour sterilize jar lid boiling water least minute pack sauce hot sterilized jar filling jar within top run knife thin spatula around inside jar filled remove air bubble wipe rim jar moist paper towel remove food residue top lid screw ring place rack bottom large stockpot fill halfway water bring boil high heat carefully lower jar pot using holder leave space jar pour boiling water necessary water level least top jar bring water full boil cover pot process minute remove jar stockpot place onto wood surface several apart cool cool press top lid finger ensuring seal tight lid move store cool dark area
doc486,preheat oven degree f degree c large bowl mix flour sugar baking powder bowl cut butter mixture look like coarse crumb stir whipping cream egg press bottom ungreased square pan arrange plum top bake preheated oven minute cake baking bowl combine whipping cream sugar vanilla egg beat well pour mixture plum bake additional minute custard set serve warm cool store refrigerator
doc487,preheat oven degree f degree c line baking sheet foil season pork tenderloin salt pepper heat olive oil heavy skillet high heat oil shimmer gently lay tenderloin hot oil minute gently loosen meat bottom skillet necessary cook pork seared golden brown color minute per side transfer pork lined baking sheet roast seared tenderloin preheated oven thermometer inserted center pork read least degree f degree c minute remove pork oven allow rest minute slicing medallion cook plum balsamic vinegar brown sugar honey blueberry juice small saucepan heat stirring often plum soft minute transfer sauce blender blend smooth return sauce saucepan simmer reduced thickened consistency apple butter minute spoon plum sauce sliced pork serve
doc488,well grease pudding mold large saucepan combine butter sugar milk date raisin currant mixed fruit peel zest orange bring boil remove heat stir baking soda sift flour cinnamon salt mix gently blended pour prepared pudding mold cover double layer greased wax paper steam hour
doc489,preheat oven degree f degree c butter square baking pan beat sugar stick butter together using electric mixer light fluffy add egg time beating addition add yogurt vanilla extract mix batter smooth add flour baking soda baking powder salt batter mix combined combine remaining sugar cinnamon separate bowl spread batter evenly prepared pan sprinkle mixture top batter plum peach sprinkle remaining mixture bake preheated oven toothpick inserted center come clean minute hour making sure overbake serve warm room temperature
doc490,chop pecan prune together blender food processor stir sugar cinnamon clove lime juice use filling cooky pastry
doc491,place plum time colander set large bowl gloved hand squeeze plum colander forcing juice hole colander discard spent pulp repeat produce plum juice pour plum juice small saucepan garlic onion place medium heat bring boil reduce heat simmer onion translucent minute pour mixture large pot add remaining plum juice stir sugar apple cider vinegar southwest chipotle seasoning roasted garlic seasoning jalapeno pepper salt liquid smoke flavoring sugar salt dissolved bring mixture boil medium heat reduce heat simmer cook sauce thickened hour stir frequently prevent burning sterilize jar lid boiling water least minute pack sauce hot sterilized jar filling jar within top run knife thin spatula around inside jar filled remove air bubble wipe rim jar moist paper towel remove food residue top lid screw ring place rack bottom large stockpot fill halfway water bring boil high heat carefully lower jar pot using holder leave space jar pour boiling water necessary water level least top jar bring water full boil cover pot process minute remove jar stockpot place onto wood surface several apart cool cool press top lid finger ensuring seal tight lid move store cool dark area
doc492,preheat oven degree f degree c mix prune apricot ginger orange zest cumin cinnamon bowl season salt black pepper open pork roast spoon stuffing center fold meat stuffing tie securely several place kitchen twine set roast onto rack roasting pan combine brown sugar flour cider vinegar cumin mustard powder paste spread brown sugar mixture roast bake preheated oven meat thermometer inserted center stuffing read degree f degree c hour transfer roast serving platter tent aluminum foil make gravy skim fat roasting pan transfer defatted dripping small saucepan pour water roasting pan scrape dissolve browned bit food water pour saucepan pan juice bring pan juice boil medium heat dissolve cornstarch water small bowl whisk cornstarch mixture pan juice stirring constantly thickened minute strain gravy gravy boat serve gravy roast
doc493,place plum saucepan heat cover simmer stirring occasionally plum soft minute mixture becomes thick start burn add water remove heat allow cool dissolve gelatin hot water bowl stir cooled plum sugar lemon juice mix gelatin sugar dissolved chill plum mixture refrigerator begin thicken minute whip evaporated milk mixing bowl electric mixer thick gently spoon whipped milk plum mixture beat electric mixer dessert fluffy well combined chill least hour serving
doc494,large punch bowl combine orange juice lemon juice grape plum pineapple stir sugar pour tea crushed ice
doc495,stir milk yeast together bowl smooth set aside foamy minute preheat oven degree f degree c line baking sheet parchment paper combine flour butter sour cream sugar egg egg yolk large bowl stir yeast mixture mix well using electric mixer first using hand turn dough onto floured work surface knead smooth adding flour time dough sticking hand form dough long log cut round cover round cloth roll round dough thin circle cut circle six triangle would pizza place jam wider end triangle roll like croissant place prepared baking sheet repeat dough used bake preheated oven rogaliki risen golden brown minute remove oven cool completely minute place confectioner sugar bowl stir water time drizzling consistency reached drizzle icing cooled rogaliki
doc496,place flour sugar lemon peel cinnamon butter work bowl food processor process mixture turn grainy stop machine add egg egg yolk process machine mixture gather one dough ball dough ball stop machine sprinkle several drop water onto dough process place dough covered container refrigerate least hour preferably overnight next day preheat oven degree f degree c allow dough rest room temperature minute warm roll dough surface make circle dough rich sticky scrape dough circle press pie dish quarter slice plum place skin side onto dough neat ring starting outer edge working neat row towards center bake preheated oven plum bubbling hot crust start brown minute allow tart cool sprinkle sugar serving
doc497,preheat oven degree f degree c grease baking dish place plum bottom prepared baking dish large bowl mash together butter white sugar mixture smooth creamy beat egg one time stir flour baking powder salt mix milk vanilla extract make smooth batter pour batter plum mix sugar butter flour cinnamon together bowl make crumbly topping spread batter bake preheated oven toothpick inserted center cake come clean minute
doc498,preheat oven degree f degree c line bread pan parchment paper spray cooking spray whisk zucchini oil white sugar brown sugar egg vanilla extract together bowl well mixed combine flour whole wheat flour baking soda salt cinnamon baking powder together separate bowl gradually stir flour mixture zucchini mixture batter combined fold plum pour batter prepared pan mix white sugar cinnamon together small bowl sprinkle batter bake preheated oven toothpick inserted center come clean hour cool pan minute removing cool completely wire rack
doc499,place spinach salad bowl top walnut feta red onion alfalfa sprout pomegranate seed drizzle vinaigrette amanda
doc500,roast poblano chile open flame gas stove grill skin black charred side turning often minute place charred chile plastic bag large bowl covered plastic wrap allow sit minute open peel skin cut slit chile lengthwise remove seed heat olive oil large pot medium heat add onion garlic cook soft translucent minute add ground pork cook browned breaking spoon cooking minute mix tomato plantain apple peach parsley candied orange peel pine nut raisin almond clove salt pepper simmer filling cooked flavor well combined minute combine walnut milk goat cheese sugar cinnamon stick blender blend walnut sauce smooth creamy fill poblano chile pork filling place plate spoon walnut sauce chile sprinkle pomegranate seed parsley dotdash meredith food studio
doc501,toss leafy green pomegranate seed blue cheese walnut together salad bowl add cranberry vinaigrette serving
doc502,preheat oven degree f degree c butter baking dish large bowl toss together apple pomegranate seed brown sugar cinnamon nutmeg spread evenly prepared pan bowl stir together oat flour sugar rub butter finger mixture resembles coarse crumb sprinkle top fruit bake minute preheated oven apple soft let stand minute serving serve warm room temperature
doc503,fill highball glass cocktail shaker ice add vodka pomegranate juice lime juice liqueur cocktail shaker secure lid place one hand lid one hand shaker shake vigorously outside shaker frost slow count pour evenly prepared glass top soda pomegranate seed stir serving
doc504,combine sugar pomegranate lemon juice large stainless steel saucepan bring boil high heat stir liquid pectin bring full rolling boil boil exactly second remove heat skim foam ladle hot sterilized jar within top seal process boiling water canner minute
doc505,preheat oven degree f degree c generously season lamb chop salt black pepper heat vegetable oil dutch oven high heat place lamb chop dutch oven cook browned side minute transfer lamb plate reduce heat medium stir onion pinch salt dutch oven cook onion slightly golden minute stir garlic cook second pour pomegranate juice dutch oven scrape browned bit bottom pot pour balsamic vinegar increase heat high bring boil stir mint leaf rosemary red pepper flake pomegranate juice mixture continue boil liquid reduced half minute return lamb accumulated juice dutch oven spoon pomegranate mixture lamb cover cook preheated oven lamb fork tender hour transfer lamb plate set dutch oven stovetop high heat bring pomegranate mixture boil cook skimming fat accumulates liquid reduced minute stir honey season salt black pepper return lamb dutch oven stir combine garnish pomegranate seed sliced mint leaf pumpkin seed chef
doc506,bowl stir together soy sauce ketchup pomegranate molasses honey sunflower seed oil mustard garlic sea salt black pepper paprika make smooth paste
doc507,place olive oil pomegranate juice rice vinegar white sugar shallot garlic white pepper salt blender blend smooth minute
doc508,heat oil saucepan medium heat cook onion soft translucent add rice toast fragrant minute pour hot vegetable broth bring boil add saffron allspice reduce heat cover simmer rice tender liquid absorbed minute toast pistachio skillet medium heat nut start turn golden brown become fragrant minute set aside stir butter cooked rice remove heat mix pistachio pomegranate seed fluff fork season salt pepper
doc509,divide lettuce two bowl halve core pear cut half slice divide pear slice pomegranate seed among two bowl mix gently combine vegetable oil pomegranate juice lemon juice mustard honey pepper saucepan bring boil high heat reduce heat simmer stirring frequently dressing thickens slightly minute pour warm dressing salad serve
doc510,blend blueberry pomegranate juice yogurt milk oat sweetener cinnamon together blender smooth minute
doc511,pour sugar pomegranate juice sauce pan warm low heat whisking continuously sugar dissolve cool pour bottle jar store sealed refrigerator
doc512,place sliced pear pomegranate seed bowl toss lemon juice coat combine brown sugar nutmeg cinnamon small bowl mix fruit cover refrigerate least hour serving blend flavor serve individual dish garnish sprinkling chopped almond sprig mint
doc513,cut sweet potato half lengthwise cut half lengthwise half cut piece half make evenly sized chunk transfer pot cover water add salt bring simmer high heat reduce heat cook potato tender minute drain thoroughly return pot mash potato need mashed sweet potato cool thoroughly transfer cooled mashed potato mixing bowl add brown sugar buttermilk mix together well combined place flour separate mixing bowl grate frozen butter flour tossing fork coat flour addition stick prevent butter clumping mixture look like floury piece butter add sweet potato mixture toss fork evenly distributed overmix transfer mixture onto lightly floured work surface push press mixture together rectangular shape thick dough floury bit crumbly fold rectangle third lifting folding onto middle side dust bit flour sticking preheat oven degree f degree c line rimmed baking sheet silicone mat press dough rectangle thick repeat step press rectangle thick trim rough edge square side maximize rising cut equal portion transfer prepared baking pan spacing biscuit evenly brush top lightly melted butter bake preheated oven browned minute cool slightly serving mix butter room temperature pomegranate syrup pomegranate juice together small bowl spread warm biscuit sprinkle pomegranate seed garnish
doc514,slice persimmon round slice round quarter place chopped spinach salad bowl top persimmon quarter pomegranate seed goat cheese sliced almond whisk together olive oil orange juice lemon juice dijon mustard salt pepper small bowl drizzle vinaigrette salad toss lightly coat serve immediately
doc515,preheat oven degree f degree c line large baking sheet parchment paper invert small bowl onto parchment paper trace rim pencil repeat twice flip parchment paper beat egg white large bowl electric mixer soft peak begin form gradually add white sugar mixer running whisk superfine sugar cornstarch small bowl gradually beat meringue continue beating meringue stiff glossy peak form beat orange blossom water vinegar spoon meringue traced circle make border higher center leave room filling bake meringue preheated oven firm dry touch hour meanwhile make lemon curd fill medium saucepan water bring bare simmer whisk lemon juice lemon zest sugar egg yolk salt together glass bowl set bowl simmering water cook whisking constantly curd foam thickens minute remove bowl simmering water gradually whisk coconut oil melted incorporated strain curd sieve discard solid left strainer press sheet plastic wrap directly onto surface prevent skin forming transfer refrigerator turn oven keep meringue inside completely dry hour combine heavy cream confectioner sugar orange blossom water bowl beat electric mixer soft peak form spoon lemon curd center cooled meringue mound whipped cream curd arrange grapefruit orange persimmon slice top sprinkle pomegranate seed top
doc516,fill small plate water pour sugar onto second small plate making depth gently dip rim champagne glass water raise glass allow excess water drip dip rim sugar twist glass ensure entire rim coated discard remaining sugar place cranberry bottom champagne glass add juice orange juice champagne
doc517,mix cranberry sugar orange juice orange zest ground clove cinnamon stick together saucepan bring boil lower heat medium simmer minute stirring constantly remove heat cool stir pomegranate seed cranberry mixture refrigerate least hour overnight remove cinnamon stick serving
doc518,heat olive oil large skillet medium heat place chicken onion skillet cook minute stirring occasionally mix pureed walnut salt pomegranate juice cardamom bring boil reduce heat low cover simmer hour stirring occasionally sauce becomes thick stir warm water mix sugar adjust seasoning simmer minute
doc519,peel core apple put peeling core small saucepan pomegranate seed juice sugar bring boil reduce heat simmer cook minute chop peeled apple place large saucepan remove zest half one orange chop fine add apple peel orange chop coarsely add pan along cranberry remaining juice sugar bring boil reduce heat simmer cook minute remove small pan heat strain juice larger pan cool solid slightly push though sieve remove seed peel adding remaining pulp larger pan stir nut desired cook minute longer serve warm room temperature chilled
doc520,preheat oven degree f degree c line roasting pan large sheet aluminum foil toss butternut squash shallot canola oil paprika chili powder chipotle powder ginger together bowl evenly mixed coated pour prepared roasting pan wrap aluminum foil around squash mixture bake preheated oven squash tender minute heat canola oil skillet medium heat cook stir reserved butternut squash seed pinch salt pinch ground black pepper skillet lightly toasted minute add brussels sprout leaf cook stirring occasionally leaf slightly crispy seed browned minute stir maple syrup seed mixture immediately remove heat pour butternut squash mixture almond milk blender half full cover hold lid pulse time leaving blend puree batch soup smooth pour butternut squash soup bowl top squash seed brussels sprout mixture pomegranate seed goat cheese
doc521,combine pomegranate juice sugar together saucepan heat degree f degree c small amount mixture dropped cold water form firm ball remove saucepan heat cover lid let cool pan cool enough touch stir remaining pomegranate juice mixture refrigerate
doc522,heat large nonstick pan heat cook halloumi slab side minute set aside allow cool slightly cut cube cheese cooking whisk pomegranate vinegar honey harissa olive oil black pepper together dressing jar set aside combine black bean kidney bean white bean onion mint cilantro bowl toss spoon add cooked halloumi drizzle vinaigrette dressing salad toss coat cover allow sit room temperature least minute
doc523,whisk pomegranate juice soy sauce garlic together shallow bowl marinade well mixed add salmon turn coat cover marinate minute heat olive oil skillet medium heat add garlic marinade cook lightly browned minute pour marinade cook reduced thickened glaze minute preheat outdoor grill heat lightly oil grate cook salmon preheated grill flesh flake easily fork minute per side serve salmon topped glaze garnished pomegranate seed
doc524,combine pomegranate juice balsamic vinegar dijon honey bowl food processor pulse combined keep blade running slowly pour canola oil food chute smooth add salt pepper set dressing aside toss apple spinach pomegranate seed pecan feta cheese together large bowl drizzle dressing top toss well combined
doc525,stir together heavy cream sugar stir pomegranate juice vanilla extract salt add mixture ice cream maker freeze according manufacturer direction
doc526,combine pomegranate juice wine lemon juice bowl whisk cinnamon nutmeg clove ginger crumble half brown sugar whisk mixture sugar dissolve melt butter skillet medium heat swirl coat pan immediately pour mixture increase heat high bring mixture boil whisking prevent scorching reduce heat medium stirring add remaining brown sugar little time cook stir mixture thickens syrupy consistency coat back spoon remove heat allow cool slightly continue cool minute stir serve
doc527,preheat oven degree f degree c season pork roast garlic kosher salt pepper place roasting pan bake roast hour preheated oven roast baking combine pomegranate seed water large saucepan bring boil reduce heat low simmer minute pomegranate seed broken released juice press strainer get much juice possible juice pour juice pomegranate saucepan bring boil simmer medium heat reduced half remove heat mix balsamic vinegar sugar cinnamon roast oven minute baste pomegranate sauce using brush apply top side continue roast pork basting every minute internal temperature reached degree f degree c minute remove oven tent foil allow rest minute carving serving
doc528,whisk vinegar pomegranate juice shallot pepper white sugar together bowl sugar dissolve add pomegranate seed cover bowl plastic wrap refrigerate chilled hour
doc529,stir freekeh saucepan heat lightly toasted fragrant minute add broth bring simmer cover pan cook water absorbed minute remove heat let stand minute transfer freekeh bowl cool meanwhile whisk vinegar tahini honey together small bowl slowly drizzle olive oil whisk combined season salt pepper add pomegranate seed onion mint parsley bowl cooked freekeh drizzle dressing toss coat season additional salt pepper desired refrigerate minute top pistachio right serving soften
doc530,place spinach arugula leaf mixing bowl add onion mandarin orange pomegranate seed toss gently hand mix
doc531,juice pomegranate retaining seed juice heat oil small skillet medium heat saute shallot golden stir pomegranate juice seed lime juice salt pepper cook minute slightly reduced remove heat stir cilantro serve room temperature
doc532,heat oil large heavy skillet medium heat stir sliced onion cook stir onion softened turned translucent minute reduce heat continue cooking stirring onion tender dark brown minute raise heat add chicken piece fry lightly browned outside pour water bring boil reduce heat low simmer minute adding water necessary keep mixture drying preheat oven degree f degree c combine walnut pomegranate juice container blender food processor process liquid done small batch necessary add mixture simmering chicken season cardamom cinnamon saffron powder salt stir cubed squash transfer entire mixture baking dish bake loosely covered hour preheated oven serve white rice
