document_id,content
doc811,mix flour water vegetable oil egg salt large bowl knead dough smooth longer sticky form dough golf ball cover let rest minute stretch ball dough thick tortilla heat large skillet heat cook tortilla browned lightly puffed minute per side layer refried bean avocado queso fresco tortilla drizzle crema top fold tortilla half filling
doc812,place shrimp large bowl stir red onion cilantro garlic add tomato clam juice ketchup lime juice horseradish hot pepper sauce mix well combine season salt gently stir avocado cover refrigerate hour
doc813,blend milk avocado banana honey together blender smooth
doc814,place tomatillo food processor add serrano pepper avocado cilantro lime juice season salt taste process smooth adjust seasoning transfer serving bowl
doc815,place avocado serving bowl mix lime juice mix mango onion habanero pepper cilantro salt
doc816,place avocado ice sugar milk lemon juice ice cream blender puree smooth
doc817,mix black bean corn tomato red bell pepper jalapeno pepper cilantro red onion lime juice vinegar salt black pepper bowl fold avocado mixture cover bowl plastic wrap putting right top salsa chill least hour
doc818,heat small skillet heat toast pine nut hot skillet lightly browned fragrant minute put spinach large salad bowl top pine nut tomato chicken avocado corn kernel goat cheese beat white wine vinegar olive oil dijon mustard together small bowl smooth season salt pepper drizzle dressing salad toss lightly coat
doc819,cut avocado half remove seed scoop pulp small bowl use fork mash avocado stir lemon juice onion salt olive oil cover bowl refrigerate hour serving
doc820,preheat oven degree f degree c grease flour two x loaf pan sift together flour baking soda baking powder salt cinnamon allspice set aside medium bowl cream together sugar butter light fluffy beat egg one time mix mashed avocado stir dry ingredient alternately buttermilk mixed fold chopped pecan raisin orange zest divide batter evenly two loaf pan bake hour preheated oven toothpick inserted center loaf come clean allow loaf cool pan least minute removing
doc821,preheat oven degree f degree c scoop flesh center avocado place mixing bowl add chicken cream cheese tomato salt pepper cayenne pepper mix well combine scoop spoonful chicken mixture well avocado top generous amount parmesan cheese place avocado half muffin stabilize bake avocado preheated oven cheese melted minute
doc822,heat refried bean large skillet brown ground beef stir seasoning packet preheat oven degree f degree c place small amount vegetable oil large skillet let oil heat place one corn tortilla skillet second flip tortilla let fry another second repeat process remaining tortilla letting drain paper towel heated tortilla drained arrange cookie sheet spread thin layer bean tortilla followed layer beef cheese bake tortilla preheated oven minute slice tortilla wedge arrange plate serving platter garnish sour cream tomato green onion chile avocado olive unknown
doc823,place sliced meat shallow bowl season salt black pepper crushed red pepper squeeze lime juice meat turn evenly coated cover refrigerate minute blender food processor combine tomatillo jalapeno puree second thick heat oil large skillet medium high heat carefully pour tomatillo mixture cook stirring frequently minute stir beef broth reduce heat simmer minute mixture coat spoon transfer mixture serving dish heat oil large skillet high heat stir beef saute minute transfer serving dish repeat remaining beef meanwhile heat tortilla oven microwave according package instruction serve place two tortilla top add desired amount meat spoon tomatillo mixture top onion tomato avocado cilantro garnish wedge lemon squeezed taco eating
doc824,soak rice hour drain rice cook rice cooker water rice must slightly dry vinegar added later immediately rice cooked mix rice vinegar hot rice spread rice plate completely cool place sheet seaweed bamboo mat press thin layer cool rice seaweed leave least top bottom edge seaweed uncovered easier sealing later dot wasabi rice arrange cucumber avocado smoked salmon rice position away bottom edge seaweed slightly wet top edge seaweed roll bottom top edge help bamboo mat tightly cut roll equal piece serve repeat roll
doc825,scoop egg yolk bowl add avocado chopped turkey bacon mayonnaise lime juice garlic cayenne pepper salt mash egg yolk mixture filling evenly combined spoon filling piping bag plastic bag snipped corner pipe filling egg white top turkey bacon piece jalapeno slice dash hot sauce
doc826,bring stock boil large pot high heat add chicken leg return boil reduce heat cover simmer minute skimming away foam form surface add carrot onion celery cilantro garlic mint cover pot cook chicken longer pink bone juice run clear minute remove chicken pot discard skin bone shred meat using fork return chicken meat pot season salt pepper add rice let chicken rice warm minute remove heat pour soup serving bowl top avocado serrano pepper squeeze lime juice
doc827,large plastic bowl lid combine arugula cherry tomato pine nut oil vinegar parmesan cheese season salt pepper taste cover shake mix divide salad onto plate top slice avocado
doc828,wash rice several change water rinse water longer cloudy drain well place covered pan rice cooker water bring boil reduce heat simmer cover pan allow rice simmer top look dry minute turn heat let stand minute absorb rest water mix rice vinegar sugar small bowl sugar dissolved stir mixture cooked rice well combined allow rice cool set aside mix imitation crabmeat mayonnaise bowl set aside roll sushi cover bamboo rolling mat plastic wrap lay sheet nori shiny side plastic wrap wet finger firmly pat thin even layer prepared rice nori leaving uncovered bottom edge sheet sprinkle rice sesame seed gently press rice carefully flip nori sheet seaweed side place long cucumber spear slice avocado imitation crab mixture line across nori sheet uncovered edge pick edge bamboo rolling sheet fold bottom edge sheet enclosing filling tightly roll sushi cylinder diameter sushi rolled wrap mat gently squeeze compact tightly cut roll piece sharp knife dipped water
doc829,place shrimp lime juice large bowl stir coat let stand minute shrimp opaque lime juice cook mix tomato onion cilantro coated lime juice cover refrigerate hour remove refrigerator mix worcestershire sauce ketchup hot sauce salt pepper hot sauce recipe use whatever hot sauce like leave let people add serving serve glass tumbler top avocado piece set extra worcestershire sauce ketchup lime wedge hot sauce people individualize dish serve saltine cracker
doc830,toast bread toaster toaster oven scoop avocado bowl add parsley olive oil lemon juice salt pepper onion powder garlic powder mash together using potato masher spread avocado mixture piece toast
doc831,heat large frying pan griddle medium heat place one tortilla flat frying pan minute flip tortilla sprinkle little cheese tortilla followed olive avocado hot pepper sauce place another tortilla top make sandwich cover quesadilla lid one minute flip quesadilla cheese melted inside remove quesadilla repeat remaining ingredient cut quesadilla triangle serve
doc832,melt butter skillet heat crack egg skillet side side cook egg white bottom layer firm enough flip minute flip egg trying crack yolk cook egg reach desired doneness minute meanwhile toast bread slice desired doneness minute mash avocado bowl stir lemon juice cayenne pepper sea salt spread avocado mixture onto toast top fried egg season sea salt pepper
doc833,bring quinoa water boil saucepan reduce heat cover simmer quinoa tender water absorbed minute set aside cool place kale steamer basket boiling water saucepan cover saucepan lid steam kale hot second transfer large plate top kale quinoa avocado cucumber bell pepper red onion feta cheese whisk olive oil lemon juice dijon mustard sea salt black pepper together bowl oil emulsifies dressing pour salad grace magyar
doc834,spread mayonnaise one slice toast spread mustard arrange sliced turkey one side spread guacamole turkey pile salad green bean sprout avocado cheese finish tomato slice place remaining slice toast top
doc835,preheat grill medium heat lightly oil grate whisk olive oil ground chipotle pepper chili powder together bowl brush entire surface avocado grill avocado preheated grill begin form avocado flesh minute
doc836,prepare ground beef directed taco seasoning package set aside large bowl combine beef mixture lettuce red onion green onion pinto bean kidney bean tomato avocado cheese mix well serving add corn chip enough dressing coat mix well serve immediately
doc837,heat oil large pot medium heat stir pepper onion stir fry mix garlic cumin cook minute vegetable tender mix tomato chile pepper pour broth season salt pepper bring boil reduce heat low simmer minute mix corn soup continue cooking minute serve bowl equal amount tortilla chip top cheese avocado
doc838,preheat oven degree f degree c line baking sheet parchment paper silicone mat spread cheddar cheese four circle placed apart bake preheated oven cheese melt lightly brown minute cool minute lifting spatula place wooden spoon handle wrapped aluminum foil balanced let taco shell cool completely minute cook beef skillet heat browned stirring often separate meat minute season taco seasoning salt pepper cook minute divide beef mixture among cheese taco shell top avocado lettuce cheddar cheese tomato
doc839,mash avocado mayonnaise together bowl thoroughly mixed preheat panini sandwich press make sandwich split ciabatta roll half flat way brush bottom roll olive oil place bottom roll onto panini press olive oil side place provolone cheese slice half spinach leaf half sliced turkey breast sliced roasted red pepper sandwich spread half avocado mixture cut surface top place top roll sandwich brush top roll olive oil close panini press cook bun toasted crisp golden brown grill mark cheese melted minute
doc840,place corn large pot enough water cover bring boil cook kernel tender crisp minute drain cool cold water use knife scrape kernel cob place kernel medium bowl stir avocado red onion bell pepper garlic add cumin red pepper flake cilantro mix vinegar olive oil lime juice season salt pepper
doc841,preheat oven degree f degree c arrange walnut single layer baking sheet toast oven minute nut begin brown large bowl toss together spinach walnut cranberry blue cheese tomato avocado red onion small bowl whisk together jam vinegar walnut oil pepper salt pour salad serving toss coat
doc842,large saute pan melt butter medium heat add shrimp lemon juice cook shrimp turn pink remove heat drain large bowl tear lettuce piece add tomato avocado celery cucumber carrot cooked shrimp toss combine top favorite dressing vinaigrette
doc843,preheat oven degree f degree c arrange tortilla strip baking sheet bake preheated oven lightly browned minute heat oil large saucepan medium heat cook onion garlic jalapeno oil lightly browned minute stir chicken chicken broth lime juice tomato salt pepper gently simmer chicken longer pink minute stir avocado cilantro heat minute adjust seasoning taste ladle soup bowl sprinkle tortilla strip serve
doc844,toast bread slice desired doneness minute mash avocado bowl stir cilantro meyer lemon juice meyer lemon zest cayenne pepper sea salt spread avocado mixture onto toast top chia seed
doc845,preheat oven degree f degree c lightly grease one x baking dish rinse fish fillet cold water pat dry paper towel lay fillet side side prepared baking dish pour salsa top sprinkle evenly shredded cheese top crushed corn chip bake uncovered preheated oven minute fish opaque flake fork serve topped sliced avocado sour cream
doc846,small bowl mix together avocado sour cream cream cheese salsa blend desired consistency small bowl mix salt pepper garlic salt onion powder stir avocado mixture cover chill refrigerator hour serving
doc847,blend avocado yogurt olive oil lemon juice garlic sea salt hot sauce black pepper together blender smooth
doc848,mash egg fork mixing bowl break add avocado onion pickle mustard mayonnaise gently smash ingredient together blended season taste salt pepper
doc849,medium bowl combine tuna cucumber avocado green onion red pepper flake sesame seed pour lemon juice sesame oil soy sauce stir carefully blend mash avocado place bowl larger bowl filled ice chill refrigerator minute longer terrific freshness fish lost chilled remove bowl ice invert onto serving plate serve toasted bread favorite cracker
doc850,combine avocado green onion cilantro seasoned salt black pepper garlic lime juice bowl mash spoon potato masher mostly smooth small chunk
doc851,preheat oven degree f degree c rub beef chicken fajita seasoning garlic powder cut beef chicken strip set aside saucepan warm refried bean heat stir salt lemon pepper garlic powder mashed avocado set aside heat corn oil deep skillet heat cut tortilla half cut half make triangular piece per tortilla place skillet many tortilla piece fit without overlapping fry crisp repeat process tortilla piece fried remove crisp tortilla paper towel discard oil wipe skillet return skillet medium heat stir beef chicken bell pepper onion cook stirring occasionally minute stir cilantro layer tortilla piece along bottom large baking dish spread refried bean evenly tortilla piece sprinkle cheese bean spread meat mixture evenly top bake preheated oven cheese bean bubbly minute remove oven drop sour cream guacamole tablespoonful various place across top sprinkle tomato jalapeno top
doc852,large salad bowl lightly mix tomato cilantro green red bell pepper jalapeno pepper green onion sweet red onion thoroughly combined gently toss avocado piece squeeze lime juice salad sprinkle salt serve
doc853,mash avocado electric mixer use food processor blend milk sugar vanilla smooth chill minute serving
doc854,heat olive oil small pan medium heat cook stir egg egg set minute place black bean bowl heat high microwave warm minute divide warmed black bean two bowl top bowl scrambled egg avocado salsa season salt black pepper
doc855,combine avocado garlic lime juice green onion cilantro tarragon food processor puree smooth melt butter saucepan low heat stir avocado puree cook low heat stirring occasionally heated minute add cream cook heated boiling season salt
doc856,bring pot water boil stir tomatillo jalapeno boil tomatillo turn bright green soft minute place cilantro avocado cooked tomatillo cooked jalapeno blender working batch necessary blend smooth minute add tomatillo cooking water needed salsa thick stop blender season salsa garlic powder salt taste blend briefly mix seasoning transfer bowl serving
doc857,preheat oven degree f degree c spread butter pork tenderloin season salt pepper thyme combine garlic powder apricot preserve honey sherry separate bowl roast pork preheated oven minute remove pork oven brush apricot sauce return pork oven continue roasting basting occasionally remaining sauce pork longer pink center minute thermometer inserted center read degree f degree c
doc858,preheat oven degree f degree c mix flour salt bowl cut shortening flour mixture pastry cutter mixture crumbly using fork mix water time dough hold together divide dough half form half ball working floured work surface roll ball crust big enough pie dish spare carefully lift crust fold quarter position pie dish unfold crust set crust aside mix sugar flour cinnamon together large bowl thoroughly combined stir lemon juice apricot spoon apricot filling pie crust dish top reserved crust crimp edge crust together fork cut away excess crust cut slit pie allow steam escape cover edge pie crust strip aluminum foil prevent burning bake center rack preheated oven pie browned filling bubbling thickened minute remove rack cool sprinkle top sugar
doc859,preheat oven degree f degree c place ham cut side onto sheet aluminum foil like put shiny side mix together brown sugar apricot jam mustard powder small bowl brush onto ham using pastry barbeque brush reserve leftover glaze enclose foil around ham place rimmed baking sheet roast hour preheated oven ham different size figure minute per apply remaining glaze minute ham done dotdash meredith food studio
doc860,preheat oven degree f degree c bring water sugar cornstarch cinnamon nutmeg boil stir thickened minute reduce heat medium add apricot butter simmer heated minute transfer mixture baking dish combine flour sugar baking powder salt large bowl cut butter flour mixture mixture resembles coarse crumb stir milk crumbles topping moistened spoon topping apricot mixture sprinkle remaining sugar topping bake preheated oven golden brown minute
doc861,mix apricot preserve wine ground ginger together small bowl set aside season pork chop salt pepper heat olive oil skillet medium high heat add pork chop cook brown side longer pink center minute per side remove chop skillet reduce heat medium low using skillet pour apricot preserve mixture simmer thickened minute return pork chop skillet turning coat side sauce cook minute
doc862,soak apricot boiling water bowl hydrated minute blend apricot remaining water vanilla extract food processor working batch blended still slightly chunky combine apricot mixture pectin large pot medium heat cook boiling add sugar lemon juice boil sugar dissolved minute sterilize jar lid boiling water least minute pack apricot jam hot sterilized jar filling jar within top run knife thin spatula around inside jar filled remove air bubble wipe rim jar moist paper towel remove food residue top lid screw ring place rack bottom large stockpot fill halfway water bring boil carefully lower jar pot using holder leave space jar pour boiling water necessary water level least top jar bring water full boil cover pot process minute remove jar stockpot place onto wood surface several apart cool hour cool press top lid finger ensuring seal tight lid move store cool dark area
doc863,layer chicken thigh onion carrot raisin apricot slow cooker whisk chicken broth tomato paste lemon juice flour garlic salt cumin ginger cinnamon paprika pepper together bowl pour chicken vegetable cook high hour low hour shred chicken slightly using fork continue cooking minute bring water boil saucepan remove heat stir couscous butter cover saucepan let stand water absorbed completely minute fluff couscous fork serve chicken tagine couscous
doc864,preheat oven degree f degree c slice top half head garlic sharp knife exposing clove discard top place head garlic piece aluminum foil drizzle olive oil wrap foil around garlic roast preheated oven golden brown minute garlic roasting place onion olive oil saucepan medium heat cook stir onion browned minute remove heat stir apricot preserve vinegar ginger cayenne pepper salt thoroughly combined squeeze roasted garlic clove skin mash bowl spoon mix garlic chutney bring boil medium heat reduce heat simmer thickened minute stirring occasionally stir carefully splash chutney burning hot pack chutney sterilized jar process seal
doc865,large bowl cream together butter sugar cream cheese smooth beat egg one time stir lemon juice lemon zest combine flour baking powder stir cream cheese mixture combined cover chill firm hour preheat oven degree f degree c roll tablespoonful dough ball place apart ungreased cookie sheet using finger make indention center ball fill apricot preserve bake minute preheated oven edge golden allow cooky cool baking sheet minute removing wire rack cool completely sprinkle confectioner sugar
doc866,heat oil dutch oven medium heat add carrot celery onion cook slightly softened minute stir garlic cook minute add beef sprinkle salt turmeric onion powder garlic powder pepper cinnamon ginger cumin coriander allspice beef vegetable stir mix continue cook stirring occasionally beef browned minute stir tomato paste combined cook minute add beef broth molasses bay leaf bring stew simmer reduce heat low cover cook stirring occasionally beef tender minute mix lentil dried apricot bring stew back simmer cover cook low stirring occasionally lentil soften minute remove discard bay leaf adjust salt pepper mix fresh lemon juice serving
doc867,preheat oven degree f degree c slice dried apricot half rinse water place sauce pan water bring boil cook minute combine cornstarch orange liqueur apricot cooking liquid mix smooth stir cooked apricot add white sugar combine pour mixture unbaked pie shell seal top crust brush milk top crust color desired bake degree f degree c hour
doc868,turn pressure cooker instant pot select saute function place olive oil hot cooker fry chicken thigh browned minute per side remove chicken inner pot set aside add onion garlic pot followed cinnamon cumin turmeric red pepper flake saffron cook stir onion soft minute press cancel leave saute mode place chicken back pot top onion mixture pour tomato chicken broth sprinkle apricot top season salt pepper close lock lid select high pressure according manufacturer instruction set timer minute allow minute pressure build release pressure using method according manufacturer instruction minute unlock remove lid stir chickpea mint leaf
doc869,place couscous bowl pour boiling water top gently stir cover let sit minute meanwhile place cranberry glass liquid measure add water cover microwave high minute drain add cranberry couscous along almond apricot scallion cumin salt pepper toss well combine serve room temperature chilled
doc870,make spice mix mix cinnamon cumin turmeric coriander ginger mint salt pepper together bowl measure spice mix set remaining mix aside another use make tagine bring small pot water boil add apricot raisin cook soft minute drain reserving cooking water place chicken reserved spice mix bowl toss thoroughly coated pour enough olive oil large skillet dutch oven coat bottom turn heat medium cook chicken hot skillet golden brown release easily skillet minute per side add onion garlic cook stir fragrant minute add apricot raisin reserved cooking water stir chicken broth honey cover reduce heat low cook chicken tender hour serve chicken garnished cilantro almond
doc871,preheat oven degree f degree c make meatloaf combine ground beef bread crumb onion egg garlic apricot preserve kosher salt pepper large mixing bowl mix well thoroughly combined transfer loaf pan bake preheated oven minute meanwhile make glaze mix ketchup apricot preserve brown sugar hot sauce worcestershire sauce cider vinegar together medium bowl remove meatloaf oven pour glaze top continue cooking longer pink center minute longer thermometer inserted center read least degree f degree c let rest minute serving
doc872,preheat oven degree f degree c season chicken drumstick salt pepper heat olive oil large skillet medium heat stir garlic red pepper flake cook stir garlic softened fragrant minute place drumstick skillet brown chicken side minute side transfer skillet oven bake chicken drumstick preheated oven longer pink bone juice run clear minute bring apricot nectar boil large pot eat reduce heat mix cornstarch water together small bowl stir cornstarch mixture curry powder apricot nectar add dried apricot transfer baked drumstick apricot mixture heat skillet used cook chicken medium heat stir onion green bell pepper carrot green chile pepper cook stir onion softened pour drumstick apricot sauce skillet cover simmer vegetable tender minute season salt pepper stir water chestnut serving
doc873,preheat oven degree f degree c lowest setting combine lemon juice apricot sugar saucepan cook medium heat sugar dissolved transfer blender puree smooth cover pan cookie sheet layer plastic wrap pour pureed fruit onto prepared pan spread evenly within edge bake hour preheated oven using spoon pair tongs keep door slightly ajar puree dried longer sticky dry cut strip store airtight container
doc874,preheat oven degree f degree c arrange apricot baking dish sprinkle white sugar mix together brown sugar flour bowl cut butter pastry cutter mixture resembles coarse crumb lightly stir rolled oat spoon mixture apricot bake preheated oven fruit soft topping browned crisp minute
doc875,saute onion garlic apricot olive oil add lentil stock bring boil reduce heat simmer minute stir tomato season cumin thyme salt pepper taste simmer minute stir lemon juice puree soup blender return pot serve
doc876,place almond sunflower seed food processor chop nut piece minute remove food processor pour bowl place remaining almond sunflower seed food processor roughly chop larger piece minute mix remaining nut seed shredded coconut dried apricot nut fruit nut mixture combined combine coconut oil honey ground cinnamon vanilla extract salt sauce pan heat cook coconut oil mixture bubble turn lighter color minute pour coconut oil mixture fruit nut mixture stir granola mixture take consistency wet sand minute line baking sheet waxed paper pour granola mixture onto sheet place second sheet waxed paper top granola mixture push waxed paper hand granola mixture evenly spread pack tightly ensure granola fall apart cool granola hardened hour cut bar
doc877,pat pork chop dry paper towel sprinkle side salt black pepper heat olive oil skillet heat brown chop well side minute per side stir honey apricot garlic cover simmer pork tender minute thermometer inserted center chop read least degree f degree c sprinkle parsley serve chop topped apricot pan juice
doc878,preheat oven degree f degree c cream butter sugar medium size mixing bowl mix flour baking powder salt egg vanilla extract mixture cool dough refrigerator hour lightly floured surface roll dough thick cut dough round round cookie cutter glass using tip place small drop apricot preserve middle circle brush edge water fold dough cookie shape half moon seal edge arrange ungreased cookie sheet bake minute golden brown dust cooky powdered sugar still hot
